UISidebarType/ui_sidebar_type/=Primarydisplay_name|Primary
UISidebarType/ui_sidebar_type/=Primarydescription|All of your most important actions (units aside), at your fingertips.
UISidebarType/ui_sidebar_type/=Unitsdisplay_name|Units
UISidebarType/ui_sidebar_type/=Unitsdescription|Manage your inventory of units, design new units, or manage and deploy teams of robots, machines, or humans.
UISidebarType/ui_sidebar_type/=Conflictsdisplay_name|Conflicts
UISidebarType/ui_sidebar_type/=Conflictsdescription|Any form of conflict (military or otherwise) that you are aware of, or participating in.
UISidebarType/ui_sidebar_type/=DetailedInteldisplay_name|Detailed Intel
UISidebarType/ui_sidebar_type/=DetailedInteldescription|Investigate detailed information about factions, districts, populations, or other aspects of the city.
UISidebarType/ui_sidebar_type/=Utilitydescription|Tools to alter things about your general experience.
